<?xml version="1.0" encoding="utf-8"?>
<regularSubmissionAgreement
   xmlns:xsd="http://www.w3.org/2001/XMLSchema-instance" 
   xsd:noNamespaceSchemaLocation="rsa.xsd"
   schemaVersion="1.0"
   id="RSA2009-01" standing="SSA2009-01">

  <!-- Submission Agreement Management -->
  <history>
    <activation>2009-02-09</activation>
    <producerEndorsement>2009-02-05</producerEndorsement>
    <archiveEndorsement>2009-02-09</archiveEndorsement>
    <expiration>2009-10-23</expiration>
    <audit>
      <created date="2009-02-01" by="Test Tester" />
      <edited date="2009-02-02" by="Test Tester" />
      <edited date="2009-02-03" by="Someone Else" />
      <committed date="2009-02-09" by="Test Tester" />
    </audit>
  </history>
  
  <!-- Archive -->
  <archiveId>Digital Collections and Archives, Tufts University</archiveId>
  <warrantToCollect>University Records Policy, http://dca.tufts.edu/?pid=19</warrantToCollect>
  
  <!-- Ingest Project Management -->
  <accessionNumber>2010.024</accessionNumber>
  <activityLogNumber>j2010.085</activityLogNumber>
  <surveyReportId>SR2010.011</surveyReportId>

  <!-- Producer -->
  <recordsCreator id="RC0034" email="dws@tufts.edu">Department of Widget Science, Tufts University</recordsCreator>
  <recordsProducer id="RC0034" email="dws@tufts.edu">Department of Widget Science, Tufts University</recordsProducer>
  <recordkeepingSystem>RK0009</recordkeepingSystem>
  
  <!-- Records -->
  <generalRecordsDescription>Paragraph goes here.</generalRecordsDescription>
  <recordType>910 Meeting Minutes and Agenda, http://dca.tufts.edu/?pid=63#rs910</recordType>
  <formatType>PDF/A</formatType>
  <dateSpan start="1995" end="2001" />
  <extent value="12" units="cu. ft." />
  <extent value="55" units="MB" />
  <extent value="7" units="CDs" />
  <copyright>Copyright holder: Allen Anderson. Licensing Agreement with Archive: See Anderson-DCA_copyrightlicense_2008-12-12.pdf</copyright>
  <access>Category 3: General University Records, Closed 20 years from records creation. http://dca.tufts.edu/?pid=17</access>
  <arrangementAndNamingScheme>Department of Widget Science naming scheme at Widget_namingscheme.doc</arrangementAndNamingScheme>
  <retentionPeriod>Retain Close of Grant Project + 7 Years, then confidentially destroy. Director of the Archive and Professor John Johnson, Department of Widget Science review records before executing disposition.</retentionPeriod>
  <retentionAlertDate>2012-10-20</retentionAlertDate>
  
  <!-- Producer to Archive -->
  <sipCreationAndTransfer>Transfer 100 image files as tifs along with inventory and descriptive metadata; place files in electronic dropbox at http://foo</sipCreationAndTransfer>
  <dropboxUrl>http://example.com/dropbox</dropboxUrl>
  <transferDate>2009-02-09</transferDate>
  
  <!-- Archive Management -->
  <sipToAip>Maintain tifs, create full and thumbnail datastreams</sipToAip>
  <archivalDescriptionStandard>Encoded Archival Description (EAD). http://www.loc.gov/ead/</archivalDescriptionStandard>
  <respectDeFonds>UA041 Department of Widget Science records</respectDeFonds>

</regularSubmissionAgreement>
